{
  "id": "tori-ending-true-final",
  "background": "hospital",
  "sprites": [
    {
      "character": "tori",
      "emotion": "happy",
      "position": "left"
    },
    {
      "character": "ronnie",
      "emotion": "happy",
      "position": "right"
    }
  ],
  "dialog": [
    {
      "speaker": "tori",
      "variant": "internal",
      "text": "\"I'm home. I'm really home. And I'll never take a single moment for granted again.\"",
      "internal": "[Morning light. Golden. Warm. The Tamagotchi rests silent on the bedside table. She made it.]\n\n**TRUE ENDING**\n\"She came home.\""
    }
  ],
  "effects": [
    {
      "type": "fade",
      "intensity": "low",
      "duration": 2000
    }
  ],
  "flags": [
    {
      "name": "ending_true_complete",
      "value": true
    },
    {
      "name": "skip_prologue_unlocked",
      "value": true
    }
  ],
  "next": "epilogue-start"
}