{
  "id": "tori-act3-ending-choice",
  "background": "hospital",
  "sprites": [],
  "dialog": [
    {
      "speaker": "narrator",
      "text": "The moment of truth. Everything converges.",
      "internal": "[Ending determined by accumulated choices and tether state.]"
    }
  ],
  "next": {
    "conditions": [
      {
        "condition": {
          "counter": {
            "name": "route_true",
            "comparison": "gte",
            "value": 5
          }
        },
        "sceneId": "tori-ending-true-start"
      },
      {
        "condition": {
          "counter": {
            "name": "route_digital",
            "comparison": "gte",
            "value": 5
          }
        },
        "sceneId": "tori-ending-digital-start"
      }
    ],
    "default": "tori-ending-bad-start"
  }
}