{
  "$schema": "../../schemas/scene.schema.json",
  "id": "prologue-street-bump",
  "background": "assets/genericBack.png",
  "sprites": [
    {
      "character": "tori",
      "emotion": "neutral",
      "position": "right"
    }
  ],
  "dialog": [
    {
      "speaker": "tori",
      "text": "I wasn't looking where I was going..."
    },
    {
      "speaker": "narrator",
      "text": "Sunny street, midday. Cafes line the background. Tori walks with coffee in hand, distracted by her Tamagotchi."
    },
    {
      "speaker": "tori",
      "text": "Oh my gosh, I'm so sorry... I wasn't paying attention!"
    },
    {
      "speaker": "narrator",
      "text": "She bumps into an older man. Both their Tamagotchis tumble to the ground. Hers scuffs, his looks worn, modified."
    },
    {
      "speaker": "tori",
      "text": "...Weird. Mine has never done that before."
    },
    {
      "speaker": "narrator",
      "text": "She bends down, picks up his Tamagotchi by mistake. The toy buzzes in her hand."
    }
  ],
  "effects": [
    {
      "type": "vhs",
      "duration": 500,
      "intensity": "low"
    }
  ],
  "flags": [
    {
      "name": "picked_up_modified_tamagotchi",
      "value": true
    }
  ],
  "unlockNote": "dev-commentary-street-bump",
  "next": "prologue-old-man"
}
