{
  "$schema": "../../schemas/scene.schema.json",
  "id": "prologue-home-arrival",
  "background": "assets/apartment.png",
  "sprites": [
    {
      "character": "ronnie",
      "emotion": "neutral",
      "position": "left"
    },
    {
      "character": "tori",
      "emotion": "happy",
      "position": "right"
    }
  ],
  "dialog": [
    {
      "speaker": "narrator",
      "text": "Tori enters her home. Ronnie is at his laptop, deep in dev mode."
    },
    {
      "speaker": "tori",
      "text": "Hey babe, I'm home!"
    },
    {
      "speaker": "ronnie",
      "text": "Hey honey! How was your day?"
    },
    {
      "speaker": "tori",
      "text": "Pretty good! Hey, can you take a look at my Ronnie-gatchi? I just changed the battery and it's already half-drained. I dropped it earlier, but... I don't think that's the problem."
    },
    {
      "speaker": "ronnie",
      "text": "Ya sure I can look at it. Why do you call it that anyway?"
    },
    {
      "speaker": "tori",
      "text": "Oh you know because this thing is sooo cute. And what better way to name it than after my man - who's even cuter!"
    },
    {
      "speaker": "narrator",
      "text": "She hands him the French Vanilla."
    },
    {
      "speaker": "ronnie",
      "text": "You're such a dork, honey."
    },
    {
      "speaker": "tori",
      "text": "Says the guy wearing the TLC hoodie. Again."
    },
    {
      "speaker": "narrator",
      "text": "She tugs playfully at his sleeve."
    },
    {
      "speaker": "ronnie",
      "text": "Well, SOMEONE keeps stealing my BGA hoodie, so this is my replacement."
    },
    {
      "speaker": "tori",
      "text": "You wear the TLC one anyway! So the BGA one is fair game. Besides, it looks better on me."
    },
    {
      "speaker": "narrator",
      "text": "She grins mischievously."
    },
    {
      "speaker": "ronnie",
      "text": "You're impossible."
    },
    {
      "speaker": "narrator",
      "text": "He shakes his head, but there's warmth in his eyes."
    },
    {
      "speaker": "tori",
      "text": "And you love me anyway, Chicharon."
    },
    {
      "speaker": "narrator",
      "text": "She boops his nose playfully. Their nickname - the one she uses when it's just them. Home."
    },
    {
      "speaker": "tori",
      "text": "I'll get dinner started. Love you!"
    },
    {
      "speaker": "narrator",
      "text": "She smiles, sets the buzzing Tamagotchi on his laptop (resting against the keyboard). Leans in, gives him a quick kiss."
    }
  ],
  "flags": [
    {
      "name": "met_ronnie",
      "value": true
    },
    {
      "name": "saw_chicharon_nickname",
      "value": true
    }
  ],
  "next": "prologue-the-fall"
}
